question,paragraph,answer
Nơi sinh sống của chi khủng long Changyuraptor vào thời kỳ Creta muộn nằm ở châu lục nào?,"Nó được biết đến từ một mẫu vật hóa thạch duy nhất đại diện cho loài Changyuraptor yangi, sống vào thời kỳ Creta muộn (125 triệu năm trước) tại Liêu Ninh, Trung Quốc. Trung Quốc (giản thể: 中国; phồn thể: 中國; bính âm: Zhōngguó), quốc hiệu là Cộng hòa Nhân dân Trung Hoa (giản thể: 中华人民共和国; phồn thể: 中華人民共和國; Hán-Việt: Trung Hoa Nhân dân Cộng hòa Quốc; bính âm: Zhōnghuá Rénmín Gònghéguó), là một quốc gia có chủ quyền nằm ở khu vực Đông Á.",Đông Á
Quốc gia của trọng tài quốc tế Stanley Rous có biên giới trên bộ với Scotland về phía tây phải không?,"Sir Stanley Ford Rous, CBE (25 tháng 4 năm 1895 - 18 tháng 7 năm 1986) là một trọng tài quốc tế người Anh và là chủ tịch thứ sáu của FIFA từ năm 1961 đến năm 1974. Quốc gia này có biên giới trên bộ với Scotland về phía bắc và với Wales về phía tây.",không
Spin-off của Ecstasy năm 2010 được phát hành dưới dạng nào?,"Tháng 6 năm 2010, Key đã phát hành một spin-off dành cho người lớn của Ecstasy mang tựa đề Kud Wafter, nó mở rộng thêm kịch bản của Noumi Kudryavka, một trong số các nhân vật nữ chính trong Little Busters! Kud Wafter (クドわふたー, Kudo Wafutā) là một visual novel dành cho người trên 18 tuổi do Key phát triển và phát hành vào ngày 25 tháng 6 năm 2010 trên hệ máy tính cá nhân (PC) dưới dạng DVD.",DVD
Thành viên Amy Lee viết lời ca khúc My Immortal có nhũ danh Lee phải không?,"Bài hát được viết lời bởi những thành viên của ban nhạc như Ben Moody, Amy Lee và David Hodges, trong khi phần sản xuất được thực hiện bởi Moody và Dave Fortman. Amy Lynn Hartzler (nhũ danh Lee, sinh ngày 13 tháng 12 năm 1981 tại Riverside, California), thường được biết tới với tên Amy Lee.",đúng
Gia Long còn có tên gọi khác là gì,"Tương truyền , có lần ( không rõ năm ) bị quân Tây Sơn đánh đuổi , chúa Nguyễn Phúc Ánh ( về sau là vua Gia Long ) đã phải chạy vào chùa trú ẩn .",chúa Nguyễn Phúc Ánh
dota là gì,Dota là một tổng ở tỉnh San José thuộc Costa Rica .,là một tổng ở tỉnh San José thuộc Costa Rica
Joe Biden nhỏ tuổi hơn Toni Polster phải không?,"Joseph Robinette Biden Jr. ( BY-dən; sinh ngày 20 tháng 11 năm 1942) là một chính trị gia người Mỹ, đương kim tổng thống thứ 46 của Hoa Kỳ. Anton (""Toni"") Polster (sinh 10 tháng 3 năm 1964 tại Viên) là cựu cầu thủ bóng đá Áo, chơi ở vị trí tiền đạo và là cầu thủ ghi nhiều bàn nhất trong lịch sử cho đội tuyển quốc gia Áo.",không
Đất nước có William McKinley là Tổng thống thứ 25 giáp biển Thái Bình Dương ở phía tây phải không?,"William McKinley, Jr. (29 tháng 1 năm 1843 - 14 tháng 9 năm 1901) là Tổng thống thứ 25 của Hoa Kỳ tại nhiệm từ năm 1897 cho đến khi ông bị ám sát vào năm 1901. Hoa Kỳ nằm giữa Bắc Mỹ, giáp biển Thái Bình Dương ở phía tây, Đại Tây Dương ở phía đông, Canada ở phía bắc và México ở phía nam.",đúng
Bộ phim nào của Rose Byrne do Matthew Vaughn đạo diễn?,"Năm 2011, cô diễn xuất trong nhiều phim thành công về thương mại như Insidious, X-Men: First Class và Bridesmaids. Dị nhân: Thế hệ đầu tiên (tựa gốc tiếng Anh: X-Men: First Class) là một bộ phim siêu anh hùng của đạo diễn Matthew Vaughn và do sản xuất Bryan Singer, dựa trên các nhân vật X-Men xuất hiện trong Marvel Comics.",X-Men: Thế hệ thứ nhất
Steve Bruce lớn tuổi hơn Salomon Kalou phải không?,"Stephen Roger ""Steve"" Bruce (sinh ngày 31 tháng 12 năm 1960, tại Corbridge, gần Hexham, Northumberland, Anh) là một cựu cầu thủ và huấn luyện viên bóng đá người Anh. Salomon Kalou (sinh ngày 5 tháng 8 năm 1985 ở Oumé, Côte d'Ivoire) là một cầu thủ bóng đá người Côte d'Ivoire.",đúng
Châm cứu là dùng cây kim đâm vào nơi nào trên cơ thể người,Châm cứu là thủ thuật chèn và thao tác kim hình chỉ vào một điểm cụ thể trên cơ thể để giảm đau hoặc cho các mục đích điều trị.,một điểm cụ thể
Ưng hoàng phúc là người nào,"Ưng Hoàng Phúc tên thật là Nguyễn Quốc Thanh ( sinh ngày 18 tháng 8 năm 1981 tại xã Kiến An , huyện Chợ Mới , tỉnh An Giang ) là một nam ca sĩ Việt Nam .",là một nam ca sĩ Việt Nam
Seventeen được chia thành mấy nhóm nhỏ,"Nhóm được chia làm 3 nhóm nhỏ phụ trách ba mảng khác nhau , đó là Hiphop , Vocal , và Performance , thế nhưng cuối cùng họ vẫn là một nhóm .",3 nhóm nhỏ
"Album nào Geoff Emerick phụ trách có tác phẩm ""With a Little Help from My Friends""?","Geoff Emerick (5 tháng 12 năm 1945 – 2 tháng 10 năm 2018) là một kỹ thuật viên âm thanh người Anh, được biết đến nhiều nhất là người phụ trách phòng thu cho The Beatles trong các album Rubber Soul, Revolver, Sgt. Pepper's Lonely Hearts Club Band, Album trắng và Abbey Road. Sgt. Pepper được coi là một trong những kiệt tác của lịch sử âm nhạc thế giới, một trong những album vĩ đại nhất, bao gồm trong đó những tác phẩm nổi tiếng như ca khúc tiêu đề, ""With a Little Help from My Friends"", ""Lucy in the Sky with Diamonds"" và ""A Day in the Life"".",Sgt. Pepper's Lonely Hearts Club Band
Đội bóng nào Bernd Schuster từng quản lý là Đội bóng bóng đá xuất sắc nhất thế kỷ 20 của FIFA?,"Sau khi giải nghệ với tư cách là một cầu thủ, ông quản lý một số câu lạc bộ châu Âu, bao gồm Real Madrid, đưa câu lạc bộ này đến chức vô địch trong mùa giải 2007-08. Real Madrid là Câu lạc bộ bóng đá xuất sắc nhất thế kỷ 20 của FIFA và được đánh giá là đội bóng vĩ đại nhất mọi thời đại.Được thành lập vào ngày 6 tháng 3 năm 1902 với tên gọi Câu lạc bộ bóng đá Madrid, câu lạc bộ có truyền thống mặc bộ trang phục sân nhà màu trắng kể từ khi thành lập.",Real Madrid C.F.
Bettoven viết bản sonat ánh trăng để tặng cho ai,"Ludwig van Beethoven viết bản sonata này dành cho cô học sinh dương cầm 17 tuổi của ông Gräfin Giulietta Guicciardi (1784–1856) vào năm 1801 và sau khi ông mất vài năm thì bản sonate được nhà phê bình âm nhạc Ludwig Rellstab đặt cho cái tên phổ biến như bây giờ, ông đã so sánh bản nhạc với ánh trăng trên hồ Lucerne.",Gräfin Giulietta Guicciardi
"Câu lạc bộ nào Mark Hughes từng làm huấn luyện viên có trụ sở tại thành phố Manchester, nước Anh?","Leslie Mark Hughes (sinh 1 tháng 11 năm 1963 tại Ruabon, Wrexham, Wales) là cựu tiền đạo bóng đá người xứ Wales, ông từng làm huấn luyện viên cho câu lạc bộ Manchester City, một thế lực mới tại giải Ngoại hạng Anh sau khi được sở hữu và chi mạnh tay bởi các ông chủ tỷ phú Ả Rập. Câu lạc bộ bóng đá Manchester City (tiếng Anh: Manchester City Football Club) là một câu lạc bộ bóng đá chuyên nghiệp có trụ sở tại thành phố Manchester, nước Anh.",Manchester City F.C.
Người cùng Hans Adolf Krebs được trao giải Nobel Sinh lý và Y khoa năm 1953 sinh năm 1986 phải không?,"Chu kỳ sau, loạt then chốt các phản ứng hóa học trong trao đổi chất, tạo ra năng lượng trong các tế bào, cũng được gọi là ""chu trình axít xitric"" đã mang lại cho ông giải Nobel Sinh lý và Y khoa năm 1953 (chung với Fritz Albert Lipmann). Fritz Albert Lipmann (12 tháng 6 năm 1899 – 24 tháng 7 năm 1986) là một nhà hóa sinh người Đức - Mỹ gốc Do Thái, người đồng phát hiện ra coenzyme A và đã đoạt giải Nobel Sinh lý và Y khoa (chung với Hans Adolf Krebs) năm 1953 cho công trình nghiên cứu này.",đúng
Đất nước có thành phố Nam Kinh có dân số ước tính đạt bao nhiêu?,"Nam Kinh (tiếng Hoa: 南京; pinyin: Nánjīng; Wade-Giles: Nan-ching; nghĩa là ""Kinh đô phía Nam"") là một thành phố thuộc tỉnh Giang Tô của Trung Quốc. Đây là quốc gia đông dân nhất trên thế giới với dân số ước tính đạt khoảng 1,405 tỷ người.","khoảng 1,405 tỷ người"
Nhà nước là gì,Nhà nước ( tiếng Anh : state ( polity ) ) là một cộng đồng chính trị ( political community ) có tổ chức sống dưới một hệ thống chính quyền đơn ( chính phủ ) ( không phải là hệ thống kép lồng ghép các chính quyền ) .,là một cộng đồng chính trị ( political community )
Richard Smalley - người được trao Giải Nobel Hóa học cùng với Harold Kroto là nhà khoa học người Mỹ phải không?,Ông được trao Giải Nobel Hóa học cùng với Richard Smalley và Robert Curl vào năm 1996 nhờ sự phát hiện Fullerene vào năm 1985. Richard Errett Smalley (1943 - 2005) là nhà hóa học người Mỹ.,đúng
Roy Makaay nhỏ tuổi hơn James Garner phải không?,"Rudolphus Antonius ""Roy"" Makaay (sinh ngày 9 tháng 3 năm 1975) là một HLV bóng đá người Hà Lan và là cựu cầu thủ bóng đá, từng chơi ở vị trí Tiền đạo. James Garner (tên khai sinh: James Scott Bumgarner; 7 tháng 4 năm 1928 – 19 tháng 7 năm 2014) là một nam diễn viên, nhà sản xuất và nghệ sĩ lồng tiếng người Mỹ.",đúng
Hong Myeong-bo lớn tuổi hơn David Beckham phải không?,"Hong Myeong-bo (tiếng Hàn: 홍명보, Hanja: 洪明甫, Hán-Việt: Hồng Minh Phủ, sinh ngày 12 tháng 2 năm 1969 tại Seoul) là cựu cầu thủ bóng đá người Hàn Quốc. David Robert Joseph Beckham (OBE, sinh ngày 2 tháng 5 năm 1975) là một cựu cầu thủ bóng đá chuyên nghiệp người Anh từng thi đấu cho các câu lạc bộ Manchester United, Preston North End, Real Madrid, A.C. Milan, Los Angeles Galaxy, Paris Saint-Germain và đội tuyển quốc gia Anh ở vị trí tiền vệ.",đúng
Maurice Gibb là một trong 3 anh em sáng lập nhóm nhạc Bee Gees và mất ngày 12 tháng 1 năm 2003 phải không?,"Bee Gees là một nhóm nhạc được thành lập vào năm 1958, bao gồm 3 anh em Barry, Robin và Maurice Gibb. Maurice Ernest Gibb (22 tháng 12 năm 1949 - 12 tháng 1 năm 2003) là một nhạc sĩ, ca sĩ,người viết nhạc,nhà sản xuất ghi âm,tay trống,tay chơi đàn ghi-ta và đàn organ trong ban nhạc Bee Gees.",đúng
Dhani Harrison lớn tuổi hơn Jonny Evans phải không?,"Jonathan Grant ""Jonny"" Evans (sinh ngày 3 tháng 1 năm 1988) là một cầu thủ bóng đá chuyên nghiệp người Bắc Ireland hiện đang thi đấu ở Premier League cho câu lạc bộ Leicester City và đội tuyển quốc gia Bắc Ireland. Dhani Harrison (sinh ngày 1 tháng 8 năm 1978) là nhạc sĩ người Anh, con trai của nghệ sĩ guitar George Harrison và vợ, Olivia Harrison.",đúng
Quê hương của Dennis Bergkamp đứng thứ ba trong chỉ số tự do báo chí năm 2016 của Phóng viên không biên giới phải không?,"Năm 2007, anh vinh dự được mời gia nhập ""Ngôi đền huyền thoại của làng bóng đá Anh""- là cầu thủ Hà Lan duy nhất và đến nay lập được ki tích này. Hà Lan đứng thứ hai trong chỉ số tự do báo chí năm 2016 của Phóng viên không biên giới.",không
Nhóm nhạc có album Get Behind Me Satan được thành lập vào năm nào?,"Get Behind Me Satan là album phòng thu thứ năm của ban nhạc alternative rock người Mỹ The White Stripes, được phát hành vào ngày 7 tháng 6 năm 2005 bởi V2 Records. The White Stripes là ban nhạc song tấu người Mỹ được thành lập vào năm 1997 ở Detroit, Michigan, Mỹ.",1997
Ian Rush lớn tuổi hơn Javier Zanetti phải không?,"Ian James Rush, MBE (sinh ngày 20 tháng 10 năm 1961) là một cựu tiền đạo người Wales được biết đến nhiều nhất với quãng thời gian anh chơi cho Liverpool. Javier Adelmar Zanetti (sinh ngày 10 tháng 8 năm 1973) là một cựu cầu thủ bóng đá người Argentina.",đúng
thương vụ bạc tỷ là gì,"Thương vụ bạc tỷ ( tên tiếng Anh : Shark Tank Việt Nam ) là phiên bản tiếng Việt của chương trình truyền hình nổi tiếng Shark Tank , dành riêng cho các startup Việt Nam .","là phiên bản tiếng Việt của chương trình truyền hình nổi tiếng Shark Tank , dành riêng cho các startup Việt Nam"
Ai là người sáng lập ra nước Cộng hoà dân chủ nhân dân Triều Tiên,"Tại Cộng hoà Dân chủ Nhân dân Triều Tiên , nước này rất tôn sùng Kim Nhật Thành , nhà lãnh đạo đã khai sinh ra nước này .",Kim Nhật Thành
Câu lạc bộ có sân nhà ở Westfalenstadion có bao nhiêu chiếc cúp vô địch quốc gia Đức?,"Đây là sân nhà của Borussia Dortmund. Với 8 chiếc cúp vô địch quốc gia Đức và 5 cúp DFB Pokal, Dortmund cũng vô địch UEFA Cup Winners' Cup vào năm 1966 (trở thành đội bóng Đức đầu tiên giành danh hiệu tầm châu lục) và giành chức vô địch UEFA Champions League vào năm 1997.",8
Hinoue Itaru - người dẫn chương trình Key Net Radio là một nữ hoạ sĩ người Nhật đến từ tỉnh Osaka phải không?,"Chương trình được dẫn bởi Orito Shinji và Hinoue Itaru của Key, cùng một người phụ nữ khác tên là Chiro làm việc cho Pekoe, một thương hiệu sản xuất visual novel khác của Visual Art's. Hinoue Itaru (樋上 いたる) (sinh ngày 1 tháng 3) là một nữ họa sĩ người Nhật đến từ tỉnh Osaka, Nhật Bản và là một trong những thành viên chủ chốt của công ty Key.",đúng
Quốc gia có câu lạc bộ F.C. Porto giáp với Đại Tây Dương ở phía nào?,"Câu lạc bộ bóng đá Porto (tiếng Bồ Đào Nha: Futebol Clube do Porto; phát âm tiếng Bồ Đào Nha: [futɨˈβɔl ˈkluβ(ɨ) ðu ˈpoɾtu]), thường được biết đến với tên gọi FC Porto hoặc đơn giản là Porto, là một câu lạc bộ bóng đá có trụ sở tại Porto, Bồ Đào Nha. Bồ Đào Nha giáp với Đại Tây Dương ở phía Tây và phía Nam, giáp Tây Ban Nha ở phía Đông và phía Bắc.",phía tây và phía nam
"Giải thưởng nào John Howard Northrop đã nhận là một giải thưởng của Viện hàn lâm Khoa học quốc gia Hoa Kỳ dành cho ""công trình nghiên cứu xuất sắc trong Động vật học và Cổ sinh vật học trong thời gian từ 3 tới 5 năm qua""?","Ngoài ra, Northrop còn giành Huy chương Daniel Giraud Elliot vào 7 năm trước đó, năm 1939. Huy chương Daniel Giraud Elliot là một giải thưởng của Viện hàn lâm Khoa học quốc gia Hoa Kỳ dành cho  ""công trình nghiên cứu xuất sắc trong Động vật học và Cổ sinh vật học trong thời gian từ 3 tới 5 năm qua"".",Huy chương Daniel Giraud Elliot
Joe Biden từng là phó tổng thống dưới thời tổng thống thứ 44 của Hoa Kỳ phải không?,"Là thành viên của Đảng Dân chủ, ông từng là phó tổng thống thứ 47 từ năm 2009 đến năm 2017 dưới thời Barack Obama và đại diện cho tiểu bang Delaware tại Thượng viện Hoa Kỳ từ năm 1973 đến năm 2009. Barack Hussein Obama II ( () bə-RAHK hoo-SAYN oh-BAH-mə; sinh ngày 4 tháng 8 năm 1961) là một chính trị gia và luật sư người Mỹ, tổng thống thứ 44 của Hoa Kỳ từ năm 2009 đến năm 2017.",đúng
Đội bóng Uwe Seeler đang chơi có trụ sở tại thành phố nào?,"Ông chơi cho câu lạc bộ Hamburger SV và có 72 lần khoác áo đội tuyển quốc gia. Hamburger Sport-Verein e. V. (phát âm tiếng Việt: Hăm-buốc) hay Hamburg hoặc HSV là một câu lạc bộ thể thao nổi tiếng của Đức có trụ sở tại thành phố Hamburg, Cộng hòa Liên bang Đức và nổi tiếng nhất là đội bóng đá của câu lạc bộ.",Hamburg
Đất nước có tiếng Tok Pisin là ngôn ngữ chính thức có thủ đô là gì?,"Tiếng Tok Pisin là ngôn ngữ chính thức của Papua New Guinea và là ngôn ngữ được dùng rộng rãi nhất ở quốc gia này. Thủ đô của Papua New Guinea, Port Moresby là một trong số các thành phố lớn của nước này.",Port Moresby
Tổ chức xếp Linkin Park đứng thứ 19 trong danh sách Best Artists of Decade được thành lập bởi ai ?,Billboard thì xếp Linkin Park đứng thứ 19 trong danh sách Best Artists of the Decade.,William Donaldson và James Hennegan
ô nhiễm môi trường là gì,"Ô nhiễm môi trường là hiện tượng môi trường tự nhiên bị bẩn , đồng thời các tính chất Vật lý , hoá học , sinh học của môi trường bị thay đổi gây tác hại tới sức khoẻ con người và các sinh vật khác .","là hiện tượng môi trường tự nhiên bị bẩn , đồng thời các tính chất Vật lý , hoá học , sinh học của môi trường bị thay đổi gây tác hại tới sức khoẻ con người và các sinh vật khác"
Đất nước của Harry Kane có dân số đạt trên 53 triệu người phải không?,"Harry Edward Kane MBE (sinh ngày 28 tháng 7 năm 1993) là một cầu thủ bóng đá chuyên nghiệp người Anh hiện đang chơi ở vị trí tiền đạo cho câu lạc bộ Tottenham Hotspur và là đội trưởng đội tuyển quốc gia Anh. Dân số Anh đạt trên 53 triệu người, chiếm 84% dân số Vương quốc Liên hiệp Anh và Bắc Ireland.",đúng
Giải thưởng Johann Deisenhofer đã đoạt năm 1988 được trao hàng năm cho các nhà khoa học trong lĩnh vực nào?,"Johann Deisenhofer sinh ngày 30.9.1943 tại Zusamaltheim, Dillingen, Bayern là nhà hóa sinh người Đức đã cùng với Hartmut Michel và Robert Huber đoạt giải Nobel Hóa học năm 1988 cho công trình nghiên cứu của họ nhằm xác định cấu trúc của một phức hệ protein gắn với màng và những đồng nhân tố (co-factors) là thiết yếu cho việc quang hợp. Giải Nobel Hoá học (tiếng Thụy Điển: Nobelpriset i kemi) được trao hàng năm bởi Viện hàn lâm khoa học Thụy Điển cho các nhà khoa học trong lĩnh vực hoá học.",hoá học
Tổng thống mà Harry S. Truman kế nhiệm qua đời vào năm nào?,"Harry S. Truman (8 tháng 5 năm 1884 - 26 tháng 12 năm 1972) là Tổng thống thứ 33 của Hoa Kỳ (1945–1953), kế nhiệm do cái chết của Franklin D. Roosevelt khi đang giữ chức vụ phó tổng thống. Franklin Delano Roosevelt (,  ROH-zə-velt; 30 tháng 1 năm 1882 – 12 tháng 4 năm 1945), thường được gọi tắt là FDR, là một chính trị gia và luật sư người Mỹ, tổng thống thứ 32 của Hoa Kỳ từ năm 1933 cho đến khi qua đời vào năm 1945.",1945
Quốc gia có Mirai Sentai Timeranger giáp với bán đảo Triều Tiên ở phía tây phải không?,"Mirai Sentai Timeranger (未来戦隊タイムレンジャー, Mirai Sentai Taimurenjā), dịch là Chiến đội tương lai Timeranger, là một chương trình truyền hình của Nhật Bản thể loại Tokusatsu. Quốc gia này nằm bên rìa phía đông của các biển: Nhật Bản, Hoa Đông, phía tây giáp với bán đảo Triều Tiên qua biển Nhật Bản, phía bắc giáp với vùng Viễn Đông của Liên bang Nga theo biển Okhotsk và phía nam giáp với đảo Đài Loan qua biển Hoa Đông.",đúng
Đương kim vô địch trong trận siêu cúp Anh đầu tiên có biệt danh là gì?,"Trận siêu cúp Anh đầu tiên diễn ra vào năm 1908, đấu lại sau trận hòa 1-1, Manchester United, lúc ấy là đương kim vô địch quốc gia đã thắng đội đoạt chức quán quân giải miền nam Queens Park Rangers với tỷ số đậm 4-0. Với biệt danh ""Quỷ Đỏ"", câu lạc bộ được thành lập dưới tên Newton Heath LYR Football Club vào năm 1878, đổi tên thành Manchester United vào năm 1902 và chuyển đến sân vận động hiện tại, Old Trafford, vào năm 1910.",Quỷ Đỏ
Nước nào rộng lớn nhất Nam Âu,"Tây Ban Nha có diện tích 505.990  km2 , là quốc gia rộng lớn nhất tại Nam Âu , và đứng thứ nhì tại Tây Âu và Liên minh châu Âu .",Tây Ban Nha
Đội bóng nào là đối thủ truyền thống của Sunderland A.F.C. đặt trụ sở tại thành phố Newcastle ở miền Đông Bắc nước Anh?,Các đối thủ truyền thống của Sunderland là hai câu lạc bộ Newcastle United và Middlesbrough. Câu lạc bộ bóng đá Newcastle United là một câu lạc bộ bóng đá chuyên nghiệp Anh đặt trụ sở tại thành phố Newcastle ở miền Đông Bắc nước Anh.,Newcastle United F.C.
Bản hit Love Me Do của The Beatles được phát hành vào ngày 5 tháng 10 phải không?,"Quản lý Brian Epstein đã đưa họ thành một nghệ sĩ chuyên nghiệp, và nhà sản xuất George Martin đã hướng dẫn và phối khí các ca khúc của họ, mở rộng thành công đáng kể trong nước sau bản hit đầu tiên, ""Love Me Do"", vào cuối năm 1962. ""Love Me Do"" là đĩa đơn đầu tay của ban nhạc The Beatles, theo kèm với nó ở mặt B là ca khúc ""P.S. I Love You"", được phát hành vào ngày 5 tháng 10 năm 1962.",đúng
Ca khúc Where Do Broken Hearts Go của Whitney Houston được viết bởi Frank Wildhorn và Chuck Jackson và sản xuất bởi Narada Michael Walden phải không?,"Houston là nghệ sĩ duy nhất trong lịch sử có được bảy bài hát liên tiếp đạt vị trí số một trên bảng xếp hạng Billboard Hot 100, bắt đầu với bài hát ""Saving All My Love for You"" phát hành năm 1985 cho đến ""Where Do Broken Hearts Go"" phát hành năm 1988. Bài hát được viết bởi Frank Wildhorn và Chuck Jackson và sản xuất bởi Narada Michael Walden.",đúng
Album có ca khúc So Happy I Could Die phát hành vào ngày nào?,"""So Happy I Could Die"" (tạm dịch: Thật Hạnh Phúc, Tôi có thể Chết) là bài hát của nữ ca sĩ-nhạc sĩ người Mỹ Lady Gaga, trích từ đĩa mở rộng The Fame Monster (2009) của cô. The Fame Monster (tạm dịch: Quái vật danh tiếng) là album phòng thu tái phát hành của nữ ca sĩ-nhạc sĩ người Mỹ Lady Gaga phát hành vào ngày 18 tháng 11 năm 2009 từ album The Fame.",ngày 18 tháng 11 năm 2009 
Đan Trường là ai,"Đan Trường ( sinh năm 1919 ) , tên thật Ngô Đức Vân Quỳnh , là một nhạc sĩ Việt Nam , tác giả nhạc phẩm "" Trách người đi "" .",một nhạc sĩ Việt Nam
Alec Baldwin nhỏ tuổi hơn Carole King phải không?,"Carole King (sinh ngày 9 tháng 2 năm 1942) là một ca sĩ, nhà soạn nhạc, diễn viên người Mỹ từng đoạt giải Grammy và Emmy. Alexander Rae ""Alec"" Baldwin III (sinh ngày 3 tháng 4 năm 1958) là một diễn viên Hoa Kỳ, anh là người nhiều tuổi nhất trong các anh em nhà Baldwin nổi tiếng ở Hollywood; một gia đình đình đám và có nhiều đóng góp cả cho truyền hình và điện ảnh suốt hai thập kỷ cuối của thế kỷ 20.",đúng
Những nước nào giáp với Tây Ban Nha,"Phần đại lục của Tây Ban Nha giáp với Địa Trung Hải về phía đông và phía nam , giáp với vịnh Biscay cùng Pháp và Andorra về phía bắc và đông bắc ; còn phía tây và tây bắc giáp với Bồ Đào Nha và Đại Tây Dương .","giáp với Địa Trung Hải về phía đông và phía nam , giáp với vịnh Biscay cùng Pháp và Andorra về phía bắc và đông bắc ; còn phía tây và tây bắc giáp với Bồ Đào Nha và Đại Tây Dương"
Nơi J. M. Barrie hát triển sự nghiệp nhà văn và nhà viết kịch có mấy di sản thế giới?,"Ông sinh ra và học tập tại Scotland sau đó chuyển tới Luân Đôn, nơi ông đã phát triển sự nghiệp nhà văn và nhà viết kịch. Luân Đôn có 4 di sản thế giới: Tháp Luân Đôn; Vườn thực vật Hoàng gia, Kew; khu vực bao gồm Cung điện Westminster, Westminster Abbey và Giáo đường St. Margaret; khu định cư lịch sử Greenwich (trong đó có Đài thiên văn Hoàng gia đánh dấu kinh tuyến 0° (Greenwich Meridian) và giờ trung bình Greenwich (GMT).",4
