question,paragraph,answer
Quê hương của nhà Trần ở tỉnh nào,"Theo Đại Việt sử ký toàn thư, quê hương của nhà Trần ở tỉnh Nam Định, về sau mới chuyển sang sinh sống ở Long Hưng, Thái Bình.",tỉnh Nam Định
Đất nước của Fujiko Fujio giáp với các vùng nào?,"Fujiko Fujio (藤子 不二雄 (Đằng Tử Bất Nhị Hùng), ふじこ ふじお, IPA: /ɸɯdʒiko ɸɯdʒio/) là bút danh chung của hai nghệ sĩ manga Nhật Bản, người Việt gọi là Ông Hai Phú hay Ông Phú Sĩ. Quốc gia này nằm bên rìa phía đông của các biển: Nhật Bản, Hoa Đông, phía tây giáp với bán đảo Triều Tiên qua biển Nhật Bản, phía bắc giáp với vùng Viễn Đông của Liên bang Nga theo biển Okhotsk và phía nam giáp với đảo Đài Loan qua biển Hoa Đông.","bán đảo Triều Tiên, vùng Viễn Đông của Liên bang Nga, đảo Đài Loan"
ASEAN là tổ chức liên kết khu vực nào,"ASEAN là tổ chức liên kết của khu vực Đông Nam Á , được tạo dựng với mục tiêu thúc đẩy tăng trưởng kinh tế , ủng hộ hoà bình khu vực , và phát triển văn hoá giữa các thành viên .",khu vực Đông Nam Á
Chu Du sinh năm mấy,"Năm 175 , quân sư và đô đốc nhà Đông Ngô của Tôn Quyền là Chu Du đã được sinh ra tại quận Lư Giang , ngày nay là huyện Lư Giang .",Năm 175
Giải thưởng mà Joss Stone giành được 2 lần được sáng lập vào năm nào?,"Stone giành được 2 giải BRIT và 1 giải Grammy. Giải thưởng được thành lập vào năm 1977 dưới dạng một buổi lễ kỷ niệm 25 năm ngày Nữ hoàng Elizabeth II lên ngôi, trước khi được chuyển thành một sự kiện thường niên vào năm 1982, dưới sự sở hữu của Công nghiệp ghi âm Anh.",năm 1977
Nghệ sĩ đóng cặp với Clark Gable trong bộ phim Cuốn theo chiều gió giành được mấy giải Oscar?,"William Clark Gable (ngày 1 tháng 2 năm 1901 – ngày 16 tháng 11 năm 1960) là một nam diễn viên điện ảnh Hoa Kỳ, được biết đến nhiều qua vai Rhett Butler trong bộ phim năm 1939 về nội chiến Mỹ Cuốn theo chiều gió, đóng cặp cùng Vivien Leigh. Bà đã giành được 2 giải Oscar ở hạng mục ""Nữ diễn viên chính xuất sắc nhất"" nhờ vai diễn người đẹp miền Nam: Scarlett O'Hara trong Cuốn theo chiều gió (1939) và Blanche DuBois trong Chuyến tàu mang tên dục vọng (1951), vai này bà cũng diễn trên sân khấu West End, Luân Đôn.",2
Giải thưởng nào George Clooney từng nhận do Hiệp hội báo chí nước ngoài ở Hollywood trao hàng năm?,"Ông từng nhận ba giải thưởng Quả Cầu Vàng với vai trò là diễn viên và hai giải Oscar, một giải cho vai diễn trong bộ phim Syriana (2006), một giải với vai trò là nhà sản xuất của bộ phim Argo (2012). Giải Quả cầu Vàng (tiếng Anh: Golden Globe Awards) là một giải thưởng của Hiệp hội báo chí nước ngoài ở Hollywood trao hàng năm cho các cống hiến xuất sắc trong ngành kỹ nghệ giải trí, cả ở Hoa Kỳ lẫn nước ngoài, và nhằm hướng sự chú ý của công chúng vào phim và chương trình truyền hình hay nhất.",Giải Quả cầu vàng
Barbara Stanwyck lớn tuổi hơn Claude Makélélé phải không?,"Barbara Stanwyck (16 tháng 7 năm 1907 – 20 tháng 1 năm 1990) là một nữ diễn viên của điện ảnh và truyền hình Hoa Kỳ. Claude Makélélé (sinh ngày 18 tháng 2 năm 1973 tại Kinshasa, Zaire, nay là Cộng hoà Dân chủ Congo) là một cựu cầu thủ bóng đá người Pháp, hiện đang là cố vấn kỹ thuật cho câu lạc bộ Chelsea.",đúng
Lê Thần Tông lên ngôi lần thứ 2 khi vua nào qua đời,"Đến năm 1643, ông nhường ngôi cho con là Lê Chân Tông để làm Thái thượng hoàng.",Lê Chân Tông
Napoleon đã thất bại khi đem quân xâm lược nước nào,"Đại quân Pháp (""La Grande Armee"") do Hoàng đế Napoleon trực tiếp chỉ huy có gần 600.000 quân gồm người Pháp và các đồng minh đã ồ ạt tiến công vào nước Nga ngày 16/6/1812, vị hoàng đế trẻ tuổi nghĩ rằng chỉ một cuộc xâm lược này là có thể buộc người Nga phải thuần phục ông.",Nga
"Câu lạc bộ nào Gary Pallister đã chơi có trụ sở tại Old Trafford, Đại Manchester, Anh?","Khi còn là một cầu thủ, anh là một hậu vệ từ năm 1984 đến 2001 và được chú ý nhất với thời gian chín năm tại Manchester United từ năm 1989 đến năm 1998. Câu lạc bộ bóng đá Manchester United (tiếng Anh: Manchester United Football Club, hay ngắn gọn là MU hay Man Utd) là một câu lạc bộ bóng đá chuyên nghiệp có trụ sở tại Old Trafford, Đại Manchester, Anh.",Manchester United F.C.
Cha của Enrique Iglesias sinh năm bao nhiêu?,"Anh là con trai của ca sĩ Julio Iglesias và Isabel Preysler. Julio Iglesias (phát âm tiếng Tây Ban Nha: [ˈxuljo iˈɣlesjas] tên đầy đủ là Julio José Iglesias de la Cueva; sinh ngày 23 tháng 9 năm 1943) là một ca sĩ, nhạc sĩ người Tây Ban Nha, đã phát hành khoảng 80 album với gần 300 triệu đĩa được bán trên khắp thế giới trong 14 thứ tiếng.",1943
Đội bóng có Patrice Evra từng là một trong những hậu vệ trái có biệt danh gì?,"Anh từng là một trong những hậu vệ trái của Manchester United. Với biệt danh ""Quỷ Đỏ"", câu lạc bộ được thành lập dưới tên Newton Heath LYR Football Club vào năm 1878, đổi tên thành Manchester United vào năm 1902 và chuyển đến sân vận động hiện tại, Old Trafford, vào năm 1910.",Quỷ Đỏ
"Tác giả ca khúc ""Bad Romance"" lớn lên ở thành phố New York phải không?","""Bad Romance"" (tạm dịch: ""Ái tình nhơ nhuốc"") là một bài hát của nữ ca sĩ-nhạc sĩ người Mỹ Lady Gaga. Sinh ra và lớn lên tại thành phố New York, cô đã được học tập tại trường Convent of the Sacred Heart trong thời gian ngắn và nhập học tại trường  Collaborative Arts Project 21.",đúng
Giải thưởng Denzel Washington giành được với vai diễn trong phim Training Day kể từ khi thành lập đã được trao cho 80 nam diễn viên phải không?,"Ông là người Mỹ gốc Phi thứ hai sau Sidney Poitier giành được Giải Oscar cho nam diễn viên chính xuất sắc nhất với vai diễn trong Training Day (2001). Kể từ khi thành lập, giải thưởng đã được trao cho 80 nam diễn viên.",đúng
Thành viên John Lennon của The Beatles sau khi nhóm tan rã vào năm 1970 thì tiếp tục sự nghiệp của một nghệ sĩ solo và hợp tác với Ono phải không?,"Với 4 thành viên John Lennon, Paul McCartney, George Harrison và Ringo Starr, họ được coi là ban nhạc có ảnh hưởng nhất mọi thời đại. Sau khi The Beatles tan rã vào năm 1970, Lennon tiếp tục sự nghiệp của một nghệ sĩ solo và hợp tác với Ono.",đúng
Nhà Nguyễn đã để lại di sản văn hoá gì cho dân tộc Việt Nam,"Thời kỳ nhà Nguyễn đã để lại nhiều di sản văn hoá cho dân tộc Việt Nam , một số di sản đã được UNESCO công nhận là di sản thế giới như Nhã nhạc cung đình Huế , Quần thể di tích Cố đô Huế hoặc Mộc bản triều Nguyễn .","nhiều di sản văn hoá cho dân tộc Việt Nam , một số di sản đã được UNESCO công nhận là di sản thế giới như Nhã nhạc cung đình Huế , Quần thể di tích Cố đô Huế hoặc Mộc bản triều Nguyễn"
Đất nước của Luis Alvarez giáp với biển Thái Bình Dương ở phía nào?,"Luis W. Alvarez (13/11/1911 - 1/9/1988) là một nhà vật lý thực nghiệm và nhà phát minh Hoa Kỳ. Hoa Kỳ nằm giữa Bắc Mỹ, giáp biển Thái Bình Dương ở phía tây, Đại Tây Dương ở phía đông, Canada ở phía bắc và México ở phía nam.",tây
Quốc gia nào lên sóng trực tiếp chương trình M Countdown là quốc gia đông dân nhất trên thế giới?,"Countdown cũng lên sóng trực tiếp ở Trung Quốc, Nhật Bản, Philippines, Mỹ, Đài Loan, Malaysia, Singapore và trong đó có Việt Nam (FPT Play). Đây là quốc gia đông dân nhất trên thế giới với dân số ước tính đạt khoảng 1,405 tỷ người.",Trung Quốc
Quốc gia mà Willy Brandt làm thủ tướng được tái thống nhất 2 miền Tây-Đông vào năm nào?,"Willy Brandt, tên khai sinh Herbert Ernst Karl Frahm (18 tháng 12 năm 1913 - 8 tháng 10 năm 1992) là một chính trị gia, thủ tướng Tây Đức từ 1969–1974, lãnh đạo Đảng Dân chủ Xã hội Đức (SPD) giai đoạn 1964–1987. Đối với quốc gia hiện tại, xem Đức Tây Đức (tiếng Đức: Westdeutschland) là tên thường dùng để chỉ nước Cộng hòa Liên bang Đức (tiếng Đức: Bundesrepublik Deutschland) trong thời kỳ từ khi nước này được thành lập ra vào ngày 23 tháng 5 năm 1949 đến khi được tái thống nhất 2 miền Tây-Đông vào ngày 3 tháng 10 năm 1990.",1990
Jerry Lee Lewis nhỏ tuổi hơn James K. Polk phải không?,"Jerry Lee Lewis (sinh ngày 29 tháng 9 năm 1935) là một nhạc sĩ - ca sĩ nhạc đồng quê và rock 'n' roll của Mỹ. James Knox Polk (2 tháng 11 năm 1795 - 15 tháng 6 năm 1849) là tổng thống thứ 11 của Hoa Kỳ, tại nhiệm từ 4 tháng 3 năm 1845 đến 4 tháng 3 năm 1849.",đúng
Sân nhà của Real Madrid C.F. là sân vận động lớn thứ mấy ở Tây Ban Nha?,Câu lạc bộ đã chơi những trận đấu trên sân nhà tại Sân vận động Santiago Bernabéu có sức chứa 81.044 chỗ ngồi ở trung tâm thành phố Madrid kể từ năm 1947. Đây là sân vận động lớn thứ hai ở Tây Ban Nha và lớn nhất trong Vùng đô thị Madrid.,hai
Giải đấu Gary Cahill đang chơi là hạng đấu cao thứ mấy của English Football League?,"Gary James Cahill (sinh 19 tháng 12, năm 1985) là một cầu thủ bóng đá Anh, thi đấu ở vị trí trung vệ và đang chơi cho CLB AFC Bournemouth ở EFL Championship. English Football League Championship (thường được gọi ngắn gọn là Championship hoặc Sky Bet Championship vì lý do tài trợ) là hạng đấu cao nhất của English Football League (EFL) và là hạng đấu cao thứ nhì của Hệ thống các giải bóng đá ở Anh chỉ sau Premier League.",nhất
Andrew Johnson lớn tuổi hơn Barbara Stanwyck phải không?,Andrew Johnson (29 tháng 12 năm 1808 - 31 tháng 7 năm 1875) là tổng thống thứ 17 của Hoa Kỳ và tại nhiệm từ năm 1865 đến năm 1867. Barbara Stanwyck (16 tháng 7 năm 1907 – 20 tháng 1 năm 1990) là một nữ diễn viên của điện ảnh và truyền hình Hoa Kỳ.,đúng
Bệnh AIDS được phát hiện đầu tiên vào năm nào,"Mãi đến năm 1981, bệnh AIDS trên lâm sàng được phát hiện đầu tiên tại Mỹ.",năm 1981
Địa đạo Củ Chi được xây dựng trên vùng đất nào,"Địa đạo Củ Chi được xây dựng trên vùng đất được mệnh danh là "" đất thép "" , nằm ở điểm cuối Đường mòn Hồ Chí Minh .","được mệnh danh là "" đất thép "" , nằm ở điểm cuối Đường mòn Hồ Chí Minh"
Gregory Peck lớn tuổi hơn John Bonham phải không?,"John Henry Bonham (31 tháng 5 năm 1948 – 25 tháng 9 năm 1980) là một nhạc công và một nhạc sĩ người Anh, được biết tới nhiều nhất trong vai trò là tay trống cho ban nhạc rock Led Zeppelin. Gregory Peck (5 tháng 4 năm 1916 – 12 tháng 6 năm 2003) là một diễn viên điện ảnh và sân khấu Mỹ.",đúng
nước nào có cảng biển lớn nhất châu á,Cảng Thượng Hải - Trung Quốc Cảng biển lớn nhất trên thế giới hiện nay chính là cảng Thượng Hải của Trung Quốc.,Trung Quốc.
Vận tốc truyền âm trong không khí là bao nhiêu,"Ở mực nước biển, tại nhiệt độ 21 °C (70 °F) và với áp suất tiêu chuẩn, tốc độ âm thanh trong không khí là khoảng 343.2 m/s (768 mph hay 1236 km/h).",khoảng 343.2 m/s (768 mph hay 1236 km/h).
bức tường Berlin sụp đổ vào năm nào,"Đã có những đề nghị là nên lấy ngày Bức tường Berlin sụp đổ vào năm 1989 , ngày 9 tháng 11 , làm ngày lễ quốc gia .",1989
"Câu lạc bộ Manchester United F.C. Gary Pallister đã chơi có trụ sở tại Old Trafford, Đại Manchester, Anh phải không?","Khi còn là một cầu thủ, anh là một hậu vệ từ năm 1984 đến 2001 và được chú ý nhất với thời gian chín năm tại Manchester United từ năm 1989 đến năm 1998. Câu lạc bộ bóng đá Manchester United (tiếng Anh: Manchester United Football Club, hay ngắn gọn là MU hay Man Utd) là một câu lạc bộ bóng đá chuyên nghiệp có trụ sở tại Old Trafford, Đại Manchester, Anh.",đúng
Đất nước có tạp chí The New Yorker có thành phố lớn nhất là gì?,"The New Yorker (n.đ ""Người New York"") là một tạp chí Hoa Kỳ chuyên viết về phóng sự, bình luận, phê bình, tiểu luận, hư cấu, châm biếm, hoạt hình và thơ ca. Quốc gia này nằm tại Tây Bán cầu, lãnh thổ bao gồm 50 tiểu bang và 1 đặc khu liên bang (trong đó có 48 tiểu bang lục địa), thủ đô là Washington, D.C., thành phố lớn nhất là New York.",New York
Ai được gọi là ông già Bến ngự,"Phan Bội Châu là một danh sĩ và là nhà cách mạng Việt Nam, hoạt động trong thời kỳ Pháp thuộc Ông được gọi là ông già Bến ngự.",Phan Bội Châu
Người đóng vai Ennis trong tác phẩm cùng tên là người nước nào?,"Trong phim, Ennis được đóng bởi Heath Ledger, người được đề cử giải Oscar cho Nam diễn viên xuất sắc nhất cho vai diễn của anh. Heathcliff Andrew Ledger (4 tháng 4 năm 1979 – 22 tháng 1 năm 2008) là một diễn viên Úc từng đoạt giải Oscar.Sau khi thực hiện các vai truyền hình trong thập niên 1990, Ledger đã phát triển sự nghiệp ở Hollywood.",Úc
Frank Zappa lớn tuổi hơn Anders Lindegaard phải không?,"Frank Vincent Zappa (sinh ngày 21 tháng 12 năm 1940, mất ngày 4 tháng 12 năm 1993) là một nhạc công, nhạc sĩ, ca sĩ, nhà sản xuất âm nhạc, kỹ thuật viên thu âm và đạo diễn phim người Mỹ. Anders Rosenkrantz Lindegaard (sinh ngày 13 tháng 4 năm 1984) là 1 cầu thủ bóng đá người Đan Mạch hiện đang thi đấu cho câu lạc bộ West Bromwich Albion ở vị trí thủ môn.",đúng
Hàm Nghi lên ngôi năm bao nhiêu tuổi,Khi đó Ưng Lịch mới 13 tuổi .,13 tuổi
Albert Einstein được trao giải Nobel trong lĩnh vực nào,"Năm 1921 , Einstein nhận giải Nobel Vật lý .",Vật lý
Giải thưởng mà Quincy Jones lập kỷ lục về đề cử ban đầu được gọi là giải gì?,"Ông hoạt động 6 thập kỷ trong nền công nghiệp giải trí và lập kỷ lục về đề cử Grammy Award (79 lần), 27 lần đoạt giải, bao gồm Grammy Legend Award vào năm 1991. Giải Grammy (cách điệu là GRAMMY; ban đầu được gọi là Giải Gramophone), hoặc đơn giản là Grammy, là giải thưởng do Viện hàn lâm Thu âm trao tặng để ghi nhận các thành tựu nổi bật trong ngành công nghiệp âm nhạc của Hoa Kỳ.",Giải Gramophone
Quê hương của Narendra Modi là quốc gia lớn thứ mấy thế giới về diện tích?,"Narendra Damodardas Modi (tiếng Gujarat: નરેન્દ્ર દામોદરદાસ મોદી, [nəreːnd̪rə d̪ɑːmoːd̪ərəd̪ɑːsə moːd̪iː] (), tiếng Hindi: नरेन्द्र दामोदरदास मोदी, sinh ngày 17 tháng 9 năm 1950) là Thủ tướng Ấn Độ thứ 15. Đây là quốc gia lớn thứ 7 về diện tích và đông dân thứ 2 trên thế giới với dân số trên 1,366 tỷ người.",7
Câu lạc bộ có áo sọc đỏ đen giống A.F.C. Bournemouth được sáng lập ngày ngày 16 tháng 12 năm 1899 phải không?,"Với biệt danh The Cherries, đội bóng theo truyền thống chơi với chiếc áo đỏ với tay áo trắng cho đến năm 1971, sau đó chuyển thành áo sọc đỏ đen, giống A.C. Milan. Associazione Calcio Milan S.p.A. (phát âm tiếng Ý: [assotʃatˈtsjoːne ˈkaltʃo ˈmiːlan]; tiếng Việt: Công ty cổ phần Câu lạc bộ bóng đá Milan, thường được biết đến với tên gọi tắt A.C. Milan, AC Milan hay đơn giản là Milan) là một câu lạc bộ bóng đá có trụ sở tại thành phố Milano, Ý được thành lập ngày 16 tháng 12 năm 1899.",đúng
Henry Kissinger từng giữ chức cố vấn an ninh đất nước dưới thời tổng thống nào là thành viên của Đảng Cộng hòa?,"Ông từng giữ chức cố vấn an ninh quốc gia Hoa Kỳ và sau đó kiêm luôn chức Bộ trưởng Ngoại giao dưới thời tổng thống Richard Nixon và Gerald Ford. Là một thành viên của Đảng Cộng hòa, Nixon từng giữ chức phó tổng thống thứ 36 từ năm 1953 đến năm 1961, vươn lên với tư cách dân biểu và thượng nghị sĩ từ tiểu bang California.",Richard Nixon
Tam quốc diễn nghĩa kể về thời kỳ nào,"Tam quốc diễn nghĩa , nguyên tên là "" Tam quốc chí thông tục diễn nghĩa "" , là một tiểu thuyết lịch sử Trung Quốc được La Quán Trung viết vào thế kỷ 14 kể về thời kỳ hỗn loạn Tam Quốc ( 190-280 ) với khoảng 120 chương hồi , theo phương pháp "" bảy thực ba hư "" ( bảy phần thực ba phần hư cấu ) .",thời kỳ hỗn loạn Tam Quốc ( 190-280 )
Charlie Chaplin lớn tuổi hơn Luca Toni phải không?,"Luca Toni (sinh 26 tháng 5 năm 1977 ở Pavullo nel Frignano, Modena) là một cựu cầu thủ bóng đá người Ý, thi đấu ở vị trí tiền đạo, từng vô địch World Cup. Sir Charles Spencer Chaplin  (16 tháng 4 năm 1889 – 25 tháng 12 năm 1977) là một nam diễn viên, nhà làm phim và nhà soạn nhạc người Anh nổi tiếng trong kỷ nguyên phim câm.",đúng
Đội bóng Glen Johnson bắt đầu sự nghiệp đã mấy lần đoạt Cúp FA?,"Anh bắt đầu sự nghiệp tại câu lạc bộ West Ham United, và đến Chelsea với giá chuyển nhượng 6 triệu £ vào năm 2003. West Ham United đã 3 lần đoạt Cúp FA, 1 lần đoạt Cúp C2 châu Âu và 1 lần đoạt cúp Intertoto.",3
Tờ báo The Korea Herald là một trong số ba nhật báo tiếng Anh xuất bản tại Hàn Quốc được thành lập vào năm 1953 phải không?,"The Korea Times tức Hàn Quốc Thời báo là tờ báo lâu đời nhất trong số ba nhật báo tiếng Anh xuất bản tại Hàn Quốc; hai tờ kia là The Korea Herald và The JoongAng Daily. The Korea Herald là nhật báo tiếng Anh được thành lập vào năm 1953 và được xuất bản tại Seoul, Hàn Quốc.",đúng
Người ta quy định lấy kinh tuyến ở kinh độ bao nhiêu làm đường chuyển ngày,"Đường đổi ngày quốc tế về cơ bản dựa vào đường kinh tuyến 180°, cắt dọc Thái Bình Dương, và nửa đường vòng quanh thế giới tính từ kinh tuyến Greenwich.","180°,"
Hệ máy nào của trò chơi Life Is Strange được gọi tắt là PS3?,"Life Is Strange là một trò chơi điện tử phiêu lưu đồ họa nhiều tập được phát triển bởi Dontnod Entertainment và được phát hành bởi Square Enix cho Microsoft Windows, PlayStation 3, PlayStation 4, Xbox 360, và Xbox One. PlayStation 3 (プレイステーション 3,, Pureisutēshon Surī, viết cách điệu là PLAYSTATION 3, thường được gọi tắt là PS3) là video game console thế hệ thứ bảy.",PlayStation 3
Thành phố mà ban nhạc The Shins thành lập nằm ở hai bên bờ sông Rio Grande phải không?,"The Shins là một ban nhạc indie-rock người Mỹ được thành lập ở Albuquerque, New Mexico vào năm 1996. Albuquerque là quận lỵ của Quận Bernalillo và nằm hai bên bờ sông Rio Grande.",đúng
Lionel Messi nhỏ tuổi hơn Brad Pitt phải không?,"Lionel Andrés Messi Cuccittini (phát âm tiếng Tây Ban Nha: [ljoˈnel anˈdɾes ˈmesi]  ( nghe); sinh ngày 24 tháng 6 năm 1987), còn được gọi là Leo Messi, là một cầu thủ bóng đá người Argentina hiện đang thi đấu ở vị trí tiền đạo cho câu lạc bộ Paris Saint-Germain và là đội trưởng của đội tuyển bóng đá quốc gia Argentina. Brad Pitt (tên thật là William Bradley Pitt sinh ngày 18 tháng 12 năm 1963) là một diễn viên và nhà sản xuất phim người Mỹ.",đúng
Nước biển như thế nào,"Nước biển có độ mặn không đồng đều trên toàn thế giới mặc dù phần lớn có độ mặn nằm trong khoảng từ 3,1% tới 3,8% .",độ mặn không đồng đều
Đất nước có cố đô là Sankt-Peterburg tồn tại từ năm năm 1721 đến năm 1917 phải không?,Đây là thành phố lớn thứ nhì ở Nga và cũng là cố đô của Đế quốc Nga. Rossiyskaya Imperiya) là một quốc gia tồn tại từ năm 1721 đến khi Chính phủ lâm thời lên nắm quyền sau cuộc Cách mạng Tháng Hai năm 1917.,đúng
"Tại thủ phủ của địch ở Sài Gòn, quân ta đã tấn công vào vị trí trọng yếu nào","Sự kiện Tết Mậu Thân: Ngay đêm tiến công đầu tiên tại Sài Gòn các đội biệt động cảm tử của Giải phóng quân đã nhằm vào các mục tiêu khó tin nhất: Toà Đại sứ quán Mỹ, dinh Tổng thống, đài phát thanh, bộ Tổng tham mưu, sân bay Tân Sơn Nhất... Sau đó quân tiếp ứng thẩm thấu vào thành phố tiếp quản các mục tiêu và tham gia chiến đấu.","Toà Đại sứ quán Mỹ, dinh Tổng thống, đài phát thanh, bộ Tổng tham mưu, sân bay Tân Sơn Nhất..."
thuốc phiện có tác dụng gì,Cơ chế tác dụng giảm đau của thuốc là sự kích thích các receptor opiate trong hệ thần kinh bắt chước các tác dụng của các endorphin tự nhiên .,giảm đau
Đan Trường còn có biệt danh là gì,"Báo chí Đài Loan còn đặt cho Đan Trường biệt danh "" Bae Yong Joon Việt Nam "" ( Bae Yong Joon là một diễn viên Hàn Quốc rất nổi tiếng tại các nước châu Á ) ..",Bae Yong Joon Việt Nam
Colin Firth nhỏ tuổi hơn Warren G. Harding phải không?,Colin Andrew Firth (sinh ngày 10 tháng 9 năm 1960) là một diễn viên người Anh. Warren Gamaliel Harding (2 tháng 11 năm 1865 – 2 tháng 8 năm 1923) là Tổng thống thứ 29 của Hoa Kỳ tại nhiệm từ năm 1921 đến khi ông qua đời vào năm 1923.,đúng
Phần Lan gia nhập Liên minh châu Âu năm bao nhiêu,Nước này là thành viên của Liên Hiệp Quốc từ năm 1955 và gia nhập Liên minh châu Âu vào năm 1995 .,năm 1995
Tổ chức mà Sir Stanley Ford Rous là chủ tịch thứ 6 năm 1961 đến 1974 được thành lập vào năm 1904 phải không?,"Sir Stanley Ford Rous, CBE (25 tháng 4 năm 1895 - 18 tháng 7 năm 1986) là một trọng tài quốc tế người Anh và là chủ tịch thứ sáu của FIFA từ năm 1961 đến năm 1974.",đúng
Trận đấu bóng đá quốc tế đầu tiên trên thế giới diễn ra tại đâu,Trận đấu quốc tế chính thức đầu tiên trong lịch sử bóng đá diễn ra vào ngày 30 tháng 11 năm 1872 tại Hamilton Crescent thuộc Glasgow giữa Scotland và Anh .,tại Hamilton Crescent thuộc Glasgow giữa Scotland và Anh
Thành phố của Bolton Wanderers là trụ sở của hai câu lạc bộ nào?,"Câu lạc bộ bóng đá Bolton Wanderers (biệt danh The Trotters) là một câu lạc bộ bóng đá chuyên nghiệp của Anh, đặt tại Horwich, Bolton thuộc thành phố Manchester, phía Tây Bắc nước Anh. Đây là trụ sở của hai câu lạc bộ bóng đá đang chơi ở Premier League, bao gồm biểu tượng của thành phố đội bóng giữ kỷ lục 20 lần vô địch quốc gia Manchester United F.C. và Manchester City F.C. , và đã tổ chức nhiều giải vô địch thế giới các môn khác nhau như đạp xe và bóng quần.",Manchester United F.C. và Manchester City F.C.
Sepp Blatter lớn tuổi hơn Florence Ballard phải không?,"Florence Glenda Ballard Chapman, tên thường gọi ""Flo"" hay ""Blondie"" (30 tháng 6 năm 1943 – 22 tháng 2 năm 1976), là một ca sĩ Mỹ, một trong những thành viên sáng lập nhóm nhạc The Supremes của Motown. Joseph S. Blatter (sinh ngày 10 tháng 3 năm 1936) là nhà quản lý bóng đá người Thụy Sĩ.",đúng
